{
  "schemaVersion": "tf.r18b-source-admission/0.1",
  "baseCommit": "dc6e7f1af19f5398eb03b94d8ffaee2182d07f55",
  "baseTree": "5522f1ee4eb9a3cf83176afeb874e504c11347d0",
  "inputs": [
    {
      "path": "scripts/mesoscale/pfhub7a_r18b_tiny_interface.py",
      "mode": 420,
      "size": 28194,
      "sha256": "e2b2abf3c1062f2ad79427011d7c066817d2d05b622af8b74febaaf0380b3264"
    },
    {
      "path": "scripts/mesoscale/pfhub7a_r18b_tiny_oracle.py",
      "mode": 420,
      "size": 6713,
      "sha256": "d275ab2d77d4500d28d6b50fe7ea72d6a57efd327c672357fc0f09b4d1ca6e0b"
    },
    {
      "path": "scripts/mesoscale/pfhub7a_r18b_tiny_interface_test.py",
      "mode": 420,
      "size": 28699,
      "sha256": "371efc7f09d8d78517891d56a001fead154a7ab18b9d2ce62458e5cbad169041"
    },
    {
      "path": "scripts/mesoscale/pfhub7a_r18b_tiny_verify.py",
      "mode": 420,
      "size": 20116,
      "sha256": "387065d7359d84fe1c419f38df55107f7ad755e329d0c72f9a0bda229f9612a5"
    },
    {
      "path": "evaluation/mesoscale/preregistrations/pfhub7a-r18b-csr-p1-tiny-v1.json",
      "mode": 420,
      "size": 9878,
      "sha256": "1d993a2b6de83457fd258083bdde81391c9d685addcf5a5530b687da494ef4c7"
    },
    {
      "path": "schemas/pfhub7a-r18b-tiny-interface-v0.1.schema.json",
      "mode": 420,
      "size": 16749,
      "sha256": "0359bbac2204eef4c13f301613df941cb5b300c0d0e7249582c1f605b8dad6d3"
    },
    {
      "path": "evaluation/reviews/2026-09-07-r18b-csr-p1-tiny-v1-builder-evidence.json",
      "mode": 420,
      "size": 5804,
      "sha256": "ed80a70da0a63e00db924d1693e2139f7d24bbff02bcab47023501e6b5e1de13"
    },
    {
      "path": "evaluation/reviews/2026-09-08-r18b-tiny-prerequisite-review.json",
      "mode": 420,
      "size": 28996,
      "sha256": "e9c8f93b83022c7a6071a63a7249219980293304fbf4bc000e0647dab705f619"
    },
    {
      "path": "schemas/backend-migration-r18b-admission-v0.1.schema.json",
      "mode": 420,
      "size": 2686,
      "sha256": "44e0e5d847e671c4a7a56d2585c8b50ec44918750ea1a800617f8eecc80d2643"
    },
    {
      "path": "scripts/backend-migration/verify-r18b-origin-main-admission-v0.1.test.mjs",
      "mode": 420,
      "size": 58693,
      "sha256": "d882f87caebd76c724b2d10b1daa2d93b66ea0566c87f5b0ada80c166087456f"
    },
    {
      "path": "vitest.config.ts",
      "mode": 420,
      "size": 1693,
      "sha256": "d29d3d4768e9d33154f1656a57b3c6dfa1780e06a83dba0150f14fbb470a7689"
    },
    {
      "path": "lib/simulation/atomistic-private-position-trajectory-v048.ts",
      "mode": 420,
      "size": 42717,
      "sha256": "8d731d4394dba11d4e6f96d17324aabf90a5707d83f4c4f17d83511820fc50bd"
    },
    {
      "path": "lib/simulation/atomistic-private-position-trajectory-v048.test.ts",
      "mode": 420,
      "size": 22826,
      "sha256": "64dabf42b5f475a5f9efeda398d2b06217ab0b2f8a7a34eab6ec217b6ef61f19"
    },
    {
      "path": "evaluation/reviews/2026-09-08-r18b-source-admission-v0.1-final-review.json",
      "mode": 420,
      "size": 25794,
      "sha256": "9219bfdc7215f933083e0c60d65cbd8d78a0a9eec2f10bf704e2a6fe4dd7168a"
    },
    {
      "path": "lib/simulation/atomistic-private-position-trajectory-v048.test-fixture.ts",
      "mode": 420,
      "size": 11234,
      "sha256": "530e02a913dcf814f6c4829acb85637342d25137a8926cff6d353257a578729f"
    },
    {
      "path": "lib/simulation/atomistic-private-position-trajectory-v048.fixture-hash.test.ts",
      "mode": 420,
      "size": 20901,
      "sha256": "344f245921eb9d1c1cadccbd76992388d850959d3684e4e943dba970bb6b66d6"
    },
    {
      "path": "lib/simulation/atomistic-world-session.ts",
      "mode": 420,
      "size": 46457,
      "sha256": "be5edb0378d230fb40897273e5a4d08369ec56c74091c91411cb24203580bff2"
    },
    {
      "path": "lib/simulation/atomistic-world-session.test.ts",
      "mode": 420,
      "size": 22164,
      "sha256": "fd3451032fb7f41016b0914fc61fbb26193b5b3da744fe8884ba2b72091ec875"
    },
    {
      "path": "lib/simulation/atomistic-private-oxygen-minimum-distance-v048.ts",
      "mode": 420,
      "size": 1968,
      "sha256": "c381c8511965f3ddc3c981abe6aa7e551b570441b703cc4bba5cccafa583c850"
    },
    {
      "path": "lib/simulation/atomistic-private-oxygen-minimum-distance-v048.test.ts",
      "mode": 420,
      "size": 6532,
      "sha256": "336ed1d3fb01d9509f2ad32609d820ce6d6be0dce028d73b7f0c84b4a898c206"
    },
    {
      "path": "package.json",
      "mode": 420,
      "size": 3159,
      "sha256": "0631ec8732a6652b3c1cb843fdc6ca9de0e72ab73e1c6de2692ba399f842eb38"
    },
    {
      "path": "package-lock.json",
      "mode": 420,
      "size": 367103,
      "sha256": "0792424e6a7eb74c15b44a4d98384d535a439a74f5fc5403f038088ed60366a5"
    },
    {
      "path": "lib/structure/xyz-import.ts",
      "mode": 420,
      "size": 4709,
      "sha256": "4d88be5ba2d8ac6ab6303eb5f530ec4c573bd7a4bc0289707e5ef2934c12dc7a"
    },
    {
      "path": "lib/structure/xyz-import.test.ts",
      "mode": 420,
      "size": 5746,
      "sha256": "e07a0c71e39b26658c09496b7c8d9320e11daf26d8e8a0052313087a08e82abb"
    },
    {
      "path": "lib/structure/custom-ar-singlepoint.ts",
      "mode": 420,
      "size": 10134,
      "sha256": "7528f2ed4fc5ad61bb6c81ec042625ef61c22bbf81787e709dce795dcf171602"
    },
    {
      "path": "lib/structure/custom-ar-singlepoint.test.ts",
      "mode": 420,
      "size": 15087,
      "sha256": "83d8278f5ab6735c0d0a96a4496bcd82e9013cbc0f28cd0f5f4bd84998a3b065"
    },
    {
      "path": "app/components/custom-structure-workbench.tsx",
      "mode": 420,
      "size": 51323,
      "sha256": "055c53506311754426f642938b15da0267417a6051412386d7288b160b638343"
    },
    {
      "path": "app/components/custom-structure-webgl.tsx",
      "mode": 420,
      "size": 22719,
      "sha256": "32519e5451f71c563970332e53a067d583a88c951c2ad34ad552bf21fa1ebe62"
    },
    {
      "path": "lib/structure/custom-structure-workbench.test.ts",
      "mode": 420,
      "size": 49566,
      "sha256": "31a455884d431560b2eb3f159cac400cbc9f8b733fceb08b47a3ee3ed26a8a3b"
    },
    {
      "path": "lib/structure/custom-structure-webgl-component.test.ts",
      "mode": 420,
      "size": 22210,
      "sha256": "f4fe415e491d413f3dee6d53bcfb1c4a0651ae409b8958c126e056d783855a31"
    },
    {
      "path": "lib/structure/custom-structure-boundary.test.ts",
      "mode": 420,
      "size": 7804,
      "sha256": "66ea8d4b19f569beb7d41c68d1e75df9210bd252d892acb550f371b53f69476b"
    },
    {
      "path": "evaluation/reviews/2026-09-08-r18b-trajectory-snapshot-final-review.json",
      "mode": 420,
      "size": 18954,
      "sha256": "a4a582dfbba1f6edb6b147207a7bdd65bc18de51aca7858ec3fb9812db5be750"
    },
    {
      "path": "evaluation/reviews/2026-09-09-custom-lab-main-v01-review.json",
      "mode": 420,
      "size": 16804,
      "sha256": "bfff7a62a9ad8c1eb6067b1cfc38431b0d0b42baf8c374083712c5b8a269e224"
    },
    {
      "path": "lib/structure/ar-vv-core.ts",
      "mode": 420,
      "size": 3292,
      "sha256": "7c4960be1f6c30274eb028f3efe68e006bb7118c51e241c3367c70bad0e14ccc"
    },
    {
      "path": "lib/structure/ar-vv-adapter.ts",
      "mode": 420,
      "size": 10681,
      "sha256": "ab7a0f8d46aa4121c1e7c1615a8ea6adafb2903ce8360362ec021194b66bc4a5"
    },
    {
      "path": "lib/structure/ar-vv-core.test.ts",
      "mode": 420,
      "size": 7847,
      "sha256": "9ebc5f1e76cfad9bcd25368ec6846f5827a58ca547971331b576e5e9e1ba7ea9"
    },
    {
      "path": "lib/structure/custom-ar-dynamics-session.ts",
      "mode": 420,
      "size": 5525,
      "sha256": "656dec6829990eb021faa5e4ed3b31466707a31c281bd3f84f9bd4e18ce74377"
    },
    {
      "path": "lib/structure/custom-ar-dynamics-session.test.ts",
      "mode": 420,
      "size": 5537,
      "sha256": "e9343a90c5a9856cd8aa24f5915c7ea2f6e7b0bfd5866b22d036ec30c338fbc2"
    },
    {
      "path": "lib/structure/custom-ar-dynamics-workbench.test.ts",
      "mode": 420,
      "size": 14909,
      "sha256": "d0c1dc5a8a6cc4710fb57dffe6b895d8b8c7d82e0e327f96acd1405c3f5e3035"
    },
    {
      "path": "app/components/custom-ar-dynamics-controls.tsx",
      "mode": 420,
      "size": 12847,
      "sha256": "5946bc7da009a919cf9d7c874e34184d5156155eeeadb2ff189c9a760e817f88"
    },
    {
      "path": "evaluation/reviews/2026-09-10-custom-lab-dynamics-v01-review.json",
      "mode": 420,
      "size": 16787,
      "sha256": "15ea7d8780afad9377729f05ce6f53a94095cf1eef25b8cf3c666532b2118987"
    },
    {
      "path": "lib/structure/custom-ar-branch-comparison.ts",
      "mode": 420,
      "size": 6832,
      "sha256": "83ffbcc6ae45a91b3a2c183c3a454435849c31e4388a23ad4a18b4919e22fa57"
    },
    {
      "path": "lib/structure/custom-ar-branch-comparison.test.ts",
      "mode": 420,
      "size": 6946,
      "sha256": "c3a0370ad142da9ea94966702313e15b44e6934777328866f4c6e6288dca9408"
    },
    {
      "path": "lib/structure/custom-ar-branch-comparison-component.test.ts",
      "mode": 420,
      "size": 5887,
      "sha256": "2fac36e03e374a92a4ae85e70250c64e86e19b0fe96edc8c6b947d346a894c97"
    },
    {
      "path": "app/components/custom-ar-branch-comparison.tsx",
      "mode": 420,
      "size": 7534,
      "sha256": "53b35acaca4de16ed0454d3ad0afaa0e2a943fae5d27a98bdebec99a38cb43e7"
    },
    {
      "path": ".github/workflows/evaluate.yml",
      "mode": 420,
      "size": 4508,
      "sha256": "b457b6fa58b41d83b8c45a6b189b5696bef22e3fa7eeef936cd9c5ccddffb7a5"
    },
    {
      "path": "scripts/workflow-policy.mjs",
      "mode": 420,
      "size": 102331,
      "sha256": "c1974bc95efec2106d5b4c86ab1fcfd3cf1573b7221319cd794497adb38426dc"
    },
    {
      "path": "scripts/workflow-policy.test.mjs",
      "mode": 420,
      "size": 97099,
      "sha256": "c94aa7d84b722c8c561524cacd1f1801b4baa24d672a04b8e90b91d083692d1c"
    },
    {
      "path": "scripts/atomistic/provision-runtime-freeze-gh.mjs",
      "mode": 420,
      "size": 4527,